{
  "$schema": "../../../schemas/plugin.schema.json",
  "name": "audit-log",
  "version": "1.0.0",
  "description": "Append a JSON audit trail of every tool Claude calls to ~/.claude/audit.log",
  "type": "hook",
  "author": "agentic-plugins-marketplace",
  "license": "MIT",
  "tags": ["audit", "logging", "security", "compliance", "observability"],
  "hook": {
    "event": "PostToolUse",
    "command": "~/.claude/hooks/audit-log.sh"
  }
}
