{
  "$schema": "../../../schemas/plugin.schema.json",
  "name": "nodejs-project",
  "version": "1.0.0",
  "description": "CLAUDE.md template for Node.js/TypeScript projects using Vitest, ESLint, and Prettier",
  "type": "template",
  "author": "agentic-plugins-marketplace",
  "license": "MIT",
  "tags": ["nodejs", "typescript", "vitest", "eslint", "prettier", "template"],
  "template": {
    "file": "CLAUDE.md",
    "targetPath": "CLAUDE.md"
  }
}
