{
  "$schema": "../../../schemas/plugin.schema.json",
  "name": "conventional-commit",
  "version": "1.0.0",
  "description": "Generate a Conventional Commits-compliant git commit message from staged changes",
  "type": "skill",
  "author": "agentic-plugins-marketplace",
  "license": "MIT",
  "tags": ["git", "commit", "conventional-commits", "workflow"],
  "skill": {
    "file": "skill.md",
    "trigger": "commit"
  }
}
