{
  "$schema": "../../../schemas/plugin.schema.json",
  "name": "explain-codebase",
  "version": "1.0.0",
  "description": "Generate a layered onboarding explanation of the current codebase for new developers",
  "type": "skill",
  "author": "agentic-plugins-marketplace",
  "license": "MIT",
  "tags": ["onboarding", "documentation", "architecture", "developer-experience"],
  "skill": {
    "file": "skill.md",
    "trigger": "explain"
  }
}
